{
  "schema_version": "kspacejet.pipeline/v1",
  "kind": "PipelineDefinition",
  "pipeline": {
    "id": "org.example.reference-cartesian",
    "revision": "1.0.0",
    "display_name": "Reference Cartesian reconstruction"
  },
  "allowed_profiles": [
    "offline",
    "bounded-online"
  ],
  "parameters": {
    "acceleration": {
      "type": "integer",
      "minimum": 1,
      "maximum": 8,
      "default": 2
    }
  },
  "provider_requirements": [
    {
      "alias": "reference",
      "provider_id": "org.kspacejet.reference",
      "version_requirement": ">=1.0.0 <2.0.0",
      "required_abi_major": 1
    }
  ],
  "nodes": [
    {
      "id": "reconstruct",
      "operator": {
        "provider": "reference",
        "id": "reference_reconstruct",
        "requires_interface_revision": "1"
      },
      "config": {
        "acceleration": {
          "$param": "acceleration"
        }
      }
    }
  ],
  "edges": [],
  "bindings": {
    "ingress": [
      {
        "id": "acquisitions",
        "type": "ismrmrd.acquisition/v1",
        "to": {
          "node": "reconstruct",
          "port": "acquisition"
        }
      }
    ],
    "egress": [
      {
        "id": "images",
        "type": "ismrmrd.image/v1",
        "from": {
          "node": "reconstruct",
          "port": "image"
        }
      }
    ],
    "calibration": [],
    "merge": []
  },
  "annotations": {}
}
